{
  "$schema": "https://json-schema.org/draft/2020-12/schema",
  "$id": "https://vpnctl.dev/schemas/v2/release-manifest-v1.schema.json",
  "title": "vpnctl canonical release manifest v1",
  "type": "object",
  "additionalProperties": false,
  "required": ["schema_version", "component_manifest", "artifacts", "apt_packages"],
  "properties": {
    "schema_version": { "const": 1 },
    "component_manifest": { "$ref": "#/$defs/component_manifest" },
    "artifacts": {
      "type": "array",
      "minItems": 1,
      "maxItems": 64,
      "items": { "$ref": "#/$defs/artifact" }
    },
    "apt_packages": {
      "type": "array",
      "minItems": 1,
      "maxItems": 64,
      "items": { "$ref": "#/$defs/apt_package" }
    }
  },
  "$defs": {
    "identifier": {
      "type": "string",
      "pattern": "^[a-z][a-z0-9-]{0,63}$"
    },
    "component_identifier": {
      "type": "string",
      "pattern": "^[a-z][a-z0-9._-]{0,62}$"
    },
    "package_name": {
      "type": "string",
      "pattern": "^[a-z0-9][a-z0-9+.-]{0,127}$"
    },
    "single_line": {
      "type": "string",
      "minLength": 1,
      "maxLength": 256,
      "pattern": "^[^\\r\\n]+$"
    },
    "sha256": {
      "type": "string",
      "pattern": "^[0-9a-f]{64}$"
    },
    "roles": {
      "type": "array",
      "minItems": 1,
      "maxItems": 2,
      "uniqueItems": true,
      "items": { "enum": ["gateway", "node"] }
    },
    "capabilities": {
      "type": "array",
      "minItems": 1,
      "uniqueItems": true,
      "items": { "$ref": "#/$defs/identifier" }
    },
    "component": {
      "type": "object",
      "additionalProperties": false,
      "required": ["name", "version", "source", "bundled", "capabilities"],
      "properties": {
        "name": { "$ref": "#/$defs/component_identifier" },
        "version": { "$ref": "#/$defs/single_line" },
        "source": { "$ref": "#/$defs/single_line" },
        "bundled": { "type": "boolean" },
        "sha256": { "$ref": "#/$defs/sha256" },
        "capabilities": { "$ref": "#/$defs/capabilities" }
      },
      "allOf": [
        {
          "if": { "properties": { "bundled": { "const": true } }, "required": ["bundled"] },
          "then": { "required": ["sha256"] }
        }
      ]
    },
    "component_manifest": {
      "type": "object",
      "additionalProperties": false,
      "required": [
        "schema_version", "manifest_version", "vpnctl_version", "control_protocols",
        "state_schema_minimum", "state_schema_maximum", "target_os",
        "target_architecture", "handshake_host_list_version",
        "migration_reversible", "components"
      ],
      "properties": {
        "schema_version": { "const": 1 },
        "manifest_version": { "const": 1 },
        "vpnctl_version": { "$ref": "#/$defs/single_line" },
        "control_protocols": {
          "type": "array",
          "minItems": 1,
          "maxItems": 2,
          "uniqueItems": true,
          "items": { "type": "string", "pattern": "^[1-9][0-9]*\\.(?:0|[1-9][0-9]*)$" }
        },
        "state_schema_minimum": { "type": "integer", "minimum": 1 },
        "state_schema_maximum": { "type": "integer", "minimum": 1 },
        "target_os": { "const": "ubuntu 24.04" },
        "target_architecture": { "const": "amd64" },
        "handshake_host_list_version": { "type": "integer", "minimum": 1 },
        "migration_reversible": { "type": "boolean" },
        "components": {
          "type": "array",
          "minItems": 1,
          "maxItems": 64,
          "items": { "$ref": "#/$defs/component" }
        }
      }
    },
    "artifact": {
      "type": "object",
      "additionalProperties": false,
      "required": ["component", "path", "sha256", "size_bytes", "roles"],
      "properties": {
        "component": { "$ref": "#/$defs/component_identifier" },
        "path": {
          "type": "string",
          "minLength": 1,
          "maxLength": 255,
          "pattern": "^[a-z0-9][a-z0-9._-]*(?:/[a-z0-9][a-z0-9._-]*)*$"
        },
        "sha256": { "$ref": "#/$defs/sha256" },
        "size_bytes": { "type": "integer", "minimum": 1, "maximum": 268435456 },
        "roles": { "$ref": "#/$defs/roles" }
      }
    },
    "apt_package": {
      "type": "object",
      "additionalProperties": false,
      "required": [
        "component", "package", "source", "minimum_version",
        "maximum_version_exclusive", "roles", "capabilities"
      ],
      "properties": {
        "component": { "$ref": "#/$defs/component_identifier" },
        "package": { "$ref": "#/$defs/package_name" },
        "source": { "$ref": "#/$defs/single_line" },
        "minimum_version": { "$ref": "#/$defs/single_line" },
        "maximum_version_exclusive": { "$ref": "#/$defs/single_line" },
        "roles": { "$ref": "#/$defs/roles" },
        "capabilities": { "$ref": "#/$defs/capabilities" }
      }
    }
  }
}
